{
  "$schema": "https://huangguang1999.github.io/paseo-skins/schema/paseo-theme-v2.schema.json",
  "schemaVersion": 2,
  "id": "chatgpt-image-2026-8-4-09-01-29",
  "version": "0.1.0",
  "name": "风和日丽",
  "description": "由 DreamSkin 社区主题「风和日丽」适配，保留原背景图。",
  "image": "chatgpt-image-2026-8-4-09-01-29.png",
  "appearance": "dark",
  "art": {
    "focusX": 0.5,
    "focusY": 0.5,
    "homeOpacity": 0.96,
    "workspaceOpacity": 0.2,
    "utilityOpacity": 0.32
  },
  "colors": {
    "background": "#131414",
    "panel": "#1d1e1e",
    "panelAlt": "#292b2b",
    "accent": "#328fd4",
    "glow": "#65abdf",
    "text": "#eff0f0",
    "muted": "#939494",
    "line": "#3f4040"
  },
  "integrity": {
    "algorithm": "sha256",
    "sha256": "063c8b9ac6442c0ab63af4b322980453b93d7dcdd0e549775f547bb634660436",
    "bytes": 3067266,
    "width": 1672,
    "height": 941
  }
}
