{
  "$schema": "https://huangguang1999.github.io/paseo-skins/schema/paseo-theme-v2.schema.json",
  "schemaVersion": 2,
  "id": "celestial-spire",
  "version": "0.1.0",
  "name": "圣穹羽光 · Celestial Spire",
  "description": "白塔沐浴晨光，天穹托起寂静。 DreamSkin 原主题包适配，保留原背景图。",
  "image": "celestial-spire.jpg",
  "appearance": "dark",
  "art": {
    "focusX": 0.72,
    "focusY": 0.38,
    "homeOpacity": 0.96,
    "workspaceOpacity": 0.2,
    "utilityOpacity": 0.32
  },
  "colors": {
    "background": "#0c1720",
    "panel": "#17242d",
    "panelAlt": "#22333e",
    "accent": "#d5b77a",
    "glow": "#dcecf3",
    "text": "#f8f4ea",
    "muted": "#b6c1c6",
    "line": "rgba(184, 205, 215, .28)"
  },
  "integrity": {
    "algorithm": "sha256",
    "sha256": "a7db370b1aacc409c7a36bb7bb1fc05fcad02104b207b4521949345a3fb05868",
    "bytes": 6465338,
    "width": 4233,
    "height": 2381
  }
}
