{
  "$schema": "https://huangguang1999.github.io/paseo-skins/schema/paseo-theme-v2.schema.json",
  "schemaVersion": 2,
  "id": "stage-black-gold",
  "version": "1.0.0",
  "name": "暗夜江湖·黑金",
  "description": "香槟金描边、浓黑工作台与克制的武侠夜色。",
  "image": "stage-black-gold-wuxia-hero-v1.png",
  "appearance": "dark",
  "art": {
    "focusX": 0.72,
    "focusY": 0.48,
    "homeOpacity": 1,
    "workspaceOpacity": 0.3,
    "utilityOpacity": 0.46
  },
  "colors": {
    "background": "#050505",
    "panel": "rgba(10, 9, 8, 0.90)",
    "panelAlt": "rgba(14, 13, 11, 0.74)",
    "accent": "#d9b86f",
    "glow": "#e8c377",
    "text": "#f6f1e7",
    "muted": "#b9aa8d",
    "line": "rgba(220, 188, 122, 0.24)"
  },
  "integrity": {
    "algorithm": "sha256",
    "sha256": "b6ad54644a61c465d4c07af22a7b8e54ef66d29e7b6e86454f9f91a28735d356",
    "bytes": 1711054,
    "width": 1672,
    "height": 941
  }
}
