{
  "$schema": "https://huangguang1999.github.io/paseo-skins/schema/paseo-theme-v2.schema.json",
  "schemaVersion": 2,
  "id": "ikun",
  "version": "1.0.0",
  "name": "Forever Kun",
  "description": "永远的「蔡徐坤」 DreamSkin 原主题包适配，保留原背景图。",
  "image": "ikun.png",
  "appearance": "dark",
  "art": {
    "focusX": 0.76,
    "focusY": 0.44,
    "homeOpacity": 0.96,
    "workspaceOpacity": 0.72,
    "utilityOpacity": 0.32
  },
  "colors": {
    "background": "#0B1118",
    "panel": "#111A24",
    "panelAlt": "#172330",
    "accent": "#B8D8C0",
    "glow": "#D0B27A",
    "text": "#EDF3EF",
    "muted": "#A7B4AE",
    "line": "rgba(184, 216, 192, 0.24)"
  },
  "integrity": {
    "algorithm": "sha256",
    "sha256": "b3173a32daff33d3c182fa6ee193633aa4b8201f5292801a423e4ed8d45beb63",
    "bytes": 1831148,
    "width": 1672,
    "height": 941
  }
}
