{
  "$schema": "https://huangguang1999.github.io/paseo-skins/schema/paseo-theme-v2.schema.json",
  "schemaVersion": 2,
  "id": "mythic-cloud-warrior",
  "version": "1.0.0",
  "name": "云海行者",
  "description": "原创行者立于云海残垣之间，赤金天光和墨色山影构成东方神话气质。",
  "image": "mythic-cloud-warrior.png",
  "appearance": "dark",
  "art": {
    "focusX": 0.76,
    "focusY": 0.52,
    "homeOpacity": 0.96,
    "workspaceOpacity": 0.2,
    "utilityOpacity": 0.32
  },
  "colors": {
    "background": "#111417",
    "panel": "rgba(10, 15, 23, 0.86)",
    "panelAlt": "rgba(57, 66, 71, 0.72)",
    "accent": "#d69a57",
    "glow": "#edc889",
    "text": "#f3f6f7",
    "muted": "#a9b3b8",
    "line": "rgba(255, 255, 255, 0.16)"
  },
  "integrity": {
    "algorithm": "sha256",
    "sha256": "1cbeeba78746ee1c2f5d0c24e4bf63e263c6cffeaebaef8a7b16598a007f2a82",
    "bytes": 1555896,
    "width": 1920,
    "height": 1080
  }
}
