{
  "$schema": "https://huangguang1999.github.io/paseo-skins/schema/paseo-theme-v2.schema.json",
  "schemaVersion": 2,
  "id": "bhieicjgdegab-73sx6aglmp",
  "version": "0.1.0",
  "name": "BHIEICJGDEGAB 73sX6Aglmp",
  "description": "由 DreamSkin 社区主题「BHIEICJGDEGAB 73sX6Aglmp」适配，保留原背景图。",
  "image": "bhieicjgdegab-73sx6aglmp.png",
  "appearance": "dark",
  "art": {
    "focusX": 0.5,
    "focusY": 0.5,
    "homeOpacity": 0.96,
    "workspaceOpacity": 0.2,
    "utilityOpacity": 0.32
  },
  "colors": {
    "background": "#131214",
    "panel": "#1d1c1e",
    "panelAlt": "#2a282c",
    "accent": "#ca58b4",
    "glow": "#d782c7",
    "text": "#f0eff1",
    "muted": "#939294",
    "line": "#3f3e40"
  },
  "integrity": {
    "algorithm": "sha256",
    "sha256": "b5eceb8f0a42a85d3659859f77450ffc1a13e67bf01a887d4dc4321dcc428c8a",
    "bytes": 325343,
    "width": 1050,
    "height": 588
  }
}
