{
  "$schema": "https://huangguang1999.github.io/paseo-skins/schema/paseo-theme-v2.schema.json",
  "schemaVersion": 2,
  "id": "preset-furina-fontaine-courtyard",
  "version": "0.1.0",
  "name": "芙宁娜·枫丹水庭",
  "description": "让灵感随水庭的聚光流动。 DreamSkin 原主题包适配，保留原背景图。",
  "image": "preset-furina-fontaine-courtyard.jpg",
  "appearance": "dark",
  "art": {
    "focusX": 0.78,
    "focusY": 0.45,
    "homeOpacity": 0.96,
    "workspaceOpacity": 0.2,
    "utilityOpacity": 0.32
  },
  "colors": {
    "background": "#172033",
    "panel": "#172033",
    "panelAlt": "#213253",
    "accent": "#9ADFFF",
    "glow": "#EAF8FF",
    "text": "#FFFFFF",
    "muted": "#E2ECF7",
    "line": "#7890B0"
  },
  "integrity": {
    "algorithm": "sha256",
    "sha256": "dba687372fd3a4e5c7f203a77ccb5e26cb9e039d2809450021a639af95c84ac5",
    "bytes": 506358,
    "width": 2560,
    "height": 1440
  }
}
