{
  "$schema": "https://huangguang1999.github.io/paseo-skins/schema/paseo-theme-v2.schema.json",
  "schemaVersion": 2,
  "id": "misty-station",
  "version": "0.1.0",
  "name": "Misty Station",
  "description": "由 DreamSkin 社区主题「Misty Station」适配，保留原背景图。",
  "image": "misty-station.png",
  "appearance": "dark",
  "art": {
    "focusX": 0.5,
    "focusY": 0.5,
    "homeOpacity": 0.96,
    "workspaceOpacity": 0.72,
    "utilityOpacity": 0.32
  },
  "colors": {
    "background": "#1A1714",
    "panel": "#221E1A",
    "panelAlt": "#2C2620",
    "accent": "#C9A76A",
    "glow": "#F2E9DA",
    "text": "#EDE6DB",
    "muted": "#8F8371",
    "line": "#3A342C"
  },
  "integrity": {
    "algorithm": "sha256",
    "sha256": "b65728f13365fa9d4f05af336fa8f6bf3defd4cbf38231b042b4297fda839500",
    "bytes": 3460895,
    "width": 1792,
    "height": 1024
  }
}
