{
  "$schema": "https://huangguang1999.github.io/paseo-skins/schema/paseo-theme-v2.schema.json",
  "schemaVersion": 2,
  "id": "jiangyuechu",
  "version": "0.1.0",
  "name": "姜大人",
  "description": "由 DreamSkin 社区主题「姜大人」适配，保留原背景图。",
  "image": "jiangyuechu.png",
  "appearance": "dark",
  "art": {
    "focusX": 0.5,
    "focusY": 0.5,
    "homeOpacity": 0.96,
    "workspaceOpacity": 0.2,
    "utilityOpacity": 0.32
  },
  "colors": {
    "background": "#131313",
    "panel": "#1d1d1e",
    "panelAlt": "#292a2b",
    "accent": "#4a7798",
    "glow": "#7799b2",
    "text": "#eff0f0",
    "muted": "#939393",
    "line": "#3f3f3f"
  },
  "integrity": {
    "algorithm": "sha256",
    "sha256": "0f3a448200e7ac571ba084349ecad227153ebd2a51639d8f21f19e567507e720",
    "bytes": 4186419,
    "width": 1920,
    "height": 1080
  }
}
