{
  "$schema": "https://huangguang1999.github.io/paseo-skins/schema/paseo-theme-v2.schema.json",
  "schemaVersion": 2,
  "id": "neon-night-watch",
  "version": "0.1.1",
  "name": "霓虹巡夜",
  "description": "东方都市异能与夜行霓虹。 DreamSkin 原主题包适配，保留原背景图。",
  "image": "neon-night-watch.png",
  "appearance": "dark",
  "art": {
    "focusX": 0.5,
    "focusY": 0.5,
    "homeOpacity": 0.96,
    "workspaceOpacity": 0.2,
    "utilityOpacity": 0.32
  },
  "colors": {
    "background": "#090f19",
    "panel": "#111b28",
    "panelAlt": "#1b2938",
    "accent": "#e33f48",
    "glow": "#6b4bd2",
    "text": "#eefaff",
    "muted": "#91a9b8",
    "line": "#37b8d0"
  },
  "integrity": {
    "algorithm": "sha256",
    "sha256": "3c63726ca6a9d2e0e2621e541dbaf60849f38fce9af8c0649f085704754cba12",
    "bytes": 3851781,
    "width": 2048,
    "height": 1152
  }
}
