{
  "$schema": "https://huangguang1999.github.io/paseo-skins/schema/paseo-theme-v2.schema.json",
  "schemaVersion": 2,
  "id": "89cd07fc-b42c-4ab7-9e25-a7c7c87c6f03",
  "version": "0.1.0",
  "name": "89cd07fc b42c 4ab7 9e25 a7c7c87c6f03",
  "description": "由 DreamSkin 社区主题「89cd07fc b42c 4ab7 9e25 a7c7c87c6f03」适配，保留原背景图。",
  "image": "89cd07fc-b42c-4ab7-9e25-a7c7c87c6f03.png",
  "appearance": "dark",
  "art": {
    "focusX": 0.5,
    "focusY": 0.5,
    "homeOpacity": 0.96,
    "workspaceOpacity": 0.2,
    "utilityOpacity": 0.32
  },
  "colors": {
    "background": "#131314",
    "panel": "#1d1d1e",
    "panelAlt": "#29292b",
    "accent": "#296de0",
    "glow": "#5f92e8",
    "text": "#efeff0",
    "muted": "#939394",
    "line": "#3f3f40"
  },
  "integrity": {
    "algorithm": "sha256",
    "sha256": "c738a1192a93006d4c6a73ae02d785e31d984867e5b0132ee472cffc09af7a02",
    "bytes": 1729556,
    "width": 1672,
    "height": 941
  }
}
