{
  "$schema": "https://huangguang1999.github.io/paseo-skins/schema/paseo-theme-v2.schema.json",
  "schemaVersion": 2,
  "id": "001rqsrzgy1ic52nlnpzlj66m34eqhdy02",
  "version": "0.1.0",
  "name": "001RqsRzgy1ic52nlnpzlj66m34eqhdy02",
  "description": "由 DreamSkin 社区主题「001RqsRzgy1ic52nlnpzlj66m34eqhdy02」适配，保留原背景图。",
  "image": "001rqsrzgy1ic52nlnpzlj66m34eqhdy02.jpg",
  "appearance": "dark",
  "art": {
    "focusX": 0.5,
    "focusY": 0.5,
    "homeOpacity": 0.96,
    "workspaceOpacity": 0.2,
    "utilityOpacity": 0.32
  },
  "colors": {
    "background": "#111415",
    "panel": "#1b1e20",
    "panelAlt": "#262c2f",
    "accent": "#11c0e2",
    "glow": "#4dd0e9",
    "text": "#eef1f2",
    "muted": "#919495",
    "line": "#3d4041"
  },
  "integrity": {
    "algorithm": "sha256",
    "sha256": "2128cddaab73af16112e90fd991dd366ce2058db122e29a27b8608c9751abba5",
    "bytes": 6857342,
    "width": 8571,
    "height": 5714
  }
}
