{
  "$schema": "https://huangguang1999.github.io/paseo-skins/schema/paseo-theme-v2.schema.json",
  "schemaVersion": 2,
  "id": "rainy-lounge-evening",
  "version": "1.0.0",
  "name": "雨幕客厅",
  "description": "雨线滑过落地窗，暖灯、沙发与唱片机把工作区变成安静的夜晚。",
  "image": "rainy-lounge-evening.png",
  "appearance": "dark",
  "art": {
    "focusX": 0.76,
    "focusY": 0.52,
    "homeOpacity": 0.96,
    "workspaceOpacity": 0.2,
    "utilityOpacity": 0.32
  },
  "colors": {
    "background": "#111722",
    "panel": "rgba(10, 15, 23, 0.86)",
    "panelAlt": "rgba(38, 56, 74, 0.72)",
    "accent": "#e9a66d",
    "glow": "#f3cf95",
    "text": "#f3f6f7",
    "muted": "#a9b3b8",
    "line": "rgba(255, 255, 255, 0.16)"
  },
  "integrity": {
    "algorithm": "sha256",
    "sha256": "0c6779f3c335f65233ccc139e975b91d871fe54fad2210dba9fd6646b37f478b",
    "bytes": 1617217,
    "width": 1920,
    "height": 1080
  }
}
