{
  "$schema": "https://huangguang1999.github.io/paseo-skins/schema/paseo-theme-v2.schema.json",
  "schemaVersion": 2,
  "id": "24007",
  "version": "0.1.0",
  "name": "李一桐漫画插画生成",
  "description": "由 DreamSkin 社区主题「李一桐漫画插画生成」适配，保留原背景图。",
  "image": "24007.png",
  "appearance": "dark",
  "art": {
    "focusX": 0,
    "focusY": 0,
    "homeOpacity": 0.96,
    "workspaceOpacity": 0.2,
    "utilityOpacity": 0.32
  },
  "colors": {
    "background": "#131313",
    "panel": "#1d1e1d",
    "panelAlt": "#2a2b29",
    "accent": "#d3ea8b",
    "glow": "#deefa8",
    "text": "#f0f0ef",
    "muted": "#939393",
    "line": "#3f3f3f"
  },
  "integrity": {
    "algorithm": "sha256",
    "sha256": "8c1c53e5f873a3e990b9cdc68c4fee594133e54da1c0f9f9bdaa1fae37eb583f",
    "bytes": 5703772,
    "width": 2848,
    "height": 1600
  }
}
