{
  "$schema": "https://huangguang1999.github.io/paseo-skins/schema/paseo-theme-v2.schema.json",
  "schemaVersion": 2,
  "id": "xiang-su",
  "version": "0.1.0",
  "name": "像素未来",
  "description": "由 DreamSkin 社区主题「像素未来」适配，保留原背景图。",
  "image": "xiang-su.png",
  "appearance": "dark",
  "art": {
    "focusX": 0.5,
    "focusY": 0.5,
    "homeOpacity": 0.96,
    "workspaceOpacity": 0.2,
    "utilityOpacity": 0.32
  },
  "colors": {
    "background": "#131314",
    "panel": "#1d1d1e",
    "panelAlt": "#29292b",
    "accent": "#645cf1",
    "glow": "#8b85f5",
    "text": "#efeff0",
    "muted": "#939394",
    "line": "#3f3f40"
  },
  "integrity": {
    "algorithm": "sha256",
    "sha256": "09bd199082d6f25b0f848cf0b83a1b9e1853ca0d0b490558c2e8f907d4310142",
    "bytes": 1187414,
    "width": 1672,
    "height": 941
  }
}
