{
  "$schema": "https://huangguang1999.github.io/paseo-skins/schema/paseo-theme-v2.schema.json",
  "schemaVersion": 2,
  "id": "idea-cosmos",
  "version": "1.0.0",
  "name": "灵感宇宙",
  "description": "纸片、公式和行星围绕发光核心旋转，把灵感整理成一座小宇宙。",
  "image": "idea-cosmos.png",
  "appearance": "dark",
  "art": {
    "focusX": 0.76,
    "focusY": 0.52,
    "homeOpacity": 0.96,
    "workspaceOpacity": 0.2,
    "utilityOpacity": 0.32
  },
  "colors": {
    "background": "#101026",
    "panel": "rgba(10, 15, 23, 0.86)",
    "panelAlt": "rgba(52, 35, 91, 0.72)",
    "accent": "#a789f1",
    "glow": "#ffcc72",
    "text": "#f3f6f7",
    "muted": "#a9b3b8",
    "line": "rgba(255, 255, 255, 0.16)"
  },
  "integrity": {
    "algorithm": "sha256",
    "sha256": "e436786efb90b8fc6b347bf6afedee74c16234b0cf672e908b309a4b9557d338",
    "bytes": 1639537,
    "width": 1920,
    "height": 1080
  }
}
