{
  "$schema": "https://huangguang1999.github.io/paseo-skins/schema/paseo-theme-v2.schema.json",
  "schemaVersion": 2,
  "id": "hacker-it",
  "version": "0.1.0",
  "name": "hacker IT",
  "description": "由 DreamSkin 社区主题「hacker IT」适配，保留原背景图。",
  "image": "hacker-it.png",
  "appearance": "dark",
  "art": {
    "focusX": 0.5,
    "focusY": 0.5,
    "homeOpacity": 0.96,
    "workspaceOpacity": 0.2,
    "utilityOpacity": 0.32
  },
  "colors": {
    "background": "#141213",
    "panel": "#1e1d1d",
    "panelAlt": "#2b2929",
    "accent": "#ee2421",
    "glow": "#f25e5d",
    "text": "#f0efef",
    "muted": "#949293",
    "line": "#403e3f"
  },
  "integrity": {
    "algorithm": "sha256",
    "sha256": "d9af5f1ee3ca348414947fa08ce3777f9c742a7ff87160489fe0a5a9dff60c23",
    "bytes": 9277215,
    "width": 3840,
    "height": 2160
  }
}
