{
  "$schema": "https://huangguang1999.github.io/paseo-skins/schema/paseo-theme-v2.schema.json",
  "schemaVersion": 2,
  "id": "cat",
  "version": "0.1.0",
  "name": "cat",
  "description": "由 DreamSkin 社区主题「cat」适配，保留原背景图。",
  "image": "cat.jpg",
  "appearance": "dark",
  "art": {
    "focusX": 0.6,
    "focusY": 0.5,
    "homeOpacity": 0.96,
    "workspaceOpacity": 0.2,
    "utilityOpacity": 0.32
  },
  "colors": {
    "background": "#151311",
    "panel": "#201d1b",
    "panelAlt": "#2e2a26",
    "accent": "#ea8e12",
    "glow": "#efaa4d",
    "text": "#f1f0ee",
    "muted": "#959391",
    "line": "#413f3d"
  },
  "integrity": {
    "algorithm": "sha256",
    "sha256": "1b28e56c5c3e88cd91c7b8b7d283e1e3f4e7f59885ea5babb5899b5520f894c6",
    "bytes": 767954,
    "width": 1672,
    "height": 941
  }
}
